ticker,date,headline,summary,source,url,category,image
AAPL,2026-04-08,Anthropic's Mythos raises questions for cybersecurity startup valuations,"Joey Schaffer/PitchBook News Anthropic’s Mythos Preview frontier model, formally announced this week, is expected to be a boon for startups in some cybersecurity categories and a competitive threat to others. The Mythos Preview model has, according to Anthropic, identified thousands of high-severity vulnerabilities “in every major operating system and browser.” It is a major revelation for the cybersecurity industry, and is expected to have immediate implications for more mature startups whose p",Yahoo,https://finnhub.io/api/news?id=d6834c81c8566aecf01c701e67cf8445a95973381ccd44c2046bdf3b607f71b3,company,https://s.yimg.com/rz/stage/p/yahoo_finance_en-US_h_p_finance_2.png
AAPL,2026-04-08,Apple’s foldable iPhone remains on track for September debut,Apple's stock had a turbulent April 7. It took two competing reports and most of a trading session to stabilize. Shares fell as much as 5% after Nikkei Asia reported engineering setbacks in the early test production phase of the company's first foldable iPhone. Then Bloomberg's Mark Gurman reported ...,Yahoo,https://finnhub.io/api/news?id=fbc4627d3f9c0846771fbbf33ada4f03dac2e7cd33116161b0b8a01b87532094,company,https://s.yimg.com/rz/stage/p/yahoo_finance_en-US_h_p_finance_2.png
AAPL,2026-04-08,Apple Gains as Mac Demand Drives Longer Lead Times,Analyst says extended delivery times signal strong demand for high-end Macs.,Yahoo,https://finnhub.io/api/news?id=c7167ef9c5a85470a1536949f4e6f07683c3b33255408a77a4f2f4153d61d285,company,https://s.yimg.com/rz/stage/p/yahoo_finance_en-US_h_p_finance_2.png
AAPL,2026-04-08,"Stocks making big moves yesterday: CrowdStrike, Avis Budget Group, Apple, Broadcom, and Tesla",Check out the companies making headlines yesterday:,Yahoo,https://finnhub.io/api/news?id=25e6a7482c29f7be0050e0ea7b4c147cf4e16229f82b1c2fbdfbc82da828dd05,company,https://s.yimg.com/rz/stage/p/yahoo_finance_en-US_h_p_finance_2.png
AAPL,2026-04-08,The Coming 2026 Growth Surge (& How to Ride it),It's no coincidence that the top five wealthiest people on Earth are products of the high-growth tech sector. 2026 will provide investors with one of the best opportunities to buy tech stocks in history.,Yahoo,https://finnhub.io/api/news?id=c0b13f13b1b2ddf7895265d3b6dc4e9d41686674637aa28ef10a1327fbe12c17,company,https://s.yimg.com/rz/stage/p/yahoo_finance_en-US_h_p_finance_2.png
AAPL,2026-04-08,"Dow spikes by over 1,300, oil prices retreat in ceasefire rally","All three of the major indexes (^DJI, ^IXIC, ^GSPC) closed Wednesday's session with colossal gains — the Dow Jones Industrial Average skyrocketed by over 1,320 points (2.85%) and the Nasdaq Composite surged by nearly 620 points (2.8%) — after President Trump announced that Iran agreed to a two-week ceasefire last night. Yahoo Finance Markets and Data Editor Jared Blikre takes a closer look at the trading day's biggest sector gainers.",Yahoo,https://finnhub.io/api/news?id=b8eea1100721bb24dd793d8dc323694304256f54def429b5dfd4bccfcf106f54,company,https://s.yimg.com/rz/stage/p/yahoo_finance_en-US_h_p_finance_2.png
AAPL,2026-04-08,Apple Turns To Samsung For Foldable Screens,Exclusive deal reflects limited supplier readiness,Yahoo,https://finnhub.io/api/news?id=66c7e78f5a4521c381df1ee5045799812cb4b6800e60ba286489a935564b0ceb,company,https://s.yimg.com/rz/stage/p/yahoo_finance_en-US_h_p_finance_2.png
AAPL,2026-04-08,"These Companies Pay 5% Dividend Yields, and They’re Hiking Them Too","Verizon, Best Buy, and VICI Properties offer dividend yields above 5% and are still increasing payouts despite market uncertainty.",Yahoo,https://finnhub.io/api/news?id=1ed4eea4df8cf2bf82c5e8b1065fd9ec63e098df7b319076dd29da47a84e3cd1,company,https://s.yimg.com/rz/stage/p/yahoo_finance_en-US_h_p_finance_2.png
AAPL,2026-04-08,Apple Shares Rise on Wedbush Bullish Call,OpenClaw Frenzy Drives Mac Demand as Apple Rides Iran Truce Higher,Yahoo,https://finnhub.io/api/news?id=3d910048e057a57ecf41b8481073b40d6615746191c73526ca3b7c389b37ce44,company,https://s.yimg.com/rz/stage/p/yahoo_finance_en-US_h_p_finance_2.png
AAPL,2026-04-08,"Anthropic's Claude Mythos Preview Just Sent Shockwaves Through the Cybersecurity Industry. It's Now Joining Forces with Nvidia, Amazon, Apple, Google, and Microsoft",Anthropics latest frontier model identified vulnerabilities in every major operating system and web browser.,Yahoo,https://finnhub.io/api/news?id=4ad5be74f027d98aceb7cf3e693220853469a9a25c962b5b5eba1e5e546a25d7,company,https://s.yimg.com/rz/stage/p/yahoo_finance_en-US_h_p_finance_2.png
AAPL,2026-04-08,How Markets Went from Iran War Angst to Watching for a New S&P 500 Record,"Stocks are flying, with a 7000 point target for the S&P 500 in sight. The change in tone is head-spinning.",Yahoo,https://finnhub.io/api/news?id=3c4aca766ffeebeeb801a6ec6754f941e4ae9241f4e79dcf4620cb947f7d4caf,company,https://s.yimg.com/rz/stage/p/yahoo_finance_en-US_h_p_finance_2.png
AAPL,2026-04-08,Apple: The Infrastructure Play On Local AI Adoption,"Apple Inc. Buy: discover how unified memory, on-device AI, and privacy drive Mac demand and high-margin servicesâI see substantial upside. Click for more on AAPL.",SeekingAlpha,https://finnhub.io/api/news?id=8d8e44dbcad7d0cb9dedf063fdc25e6c1643a941968347ea1e818d540be486d8,company,https://static.seekingalpha.com/cdn/s3/uploads/getty_images/1403433859/image_1403433859.jpg?io=getty-c-w1536
AAPL,2026-04-08,Apple Foldable Timeline Holds Despite Noise,Engineering issues noted but launch still on track,Yahoo,https://finnhub.io/api/news?id=2fcd555085924f285d9fb1ebb5ea64e2e4985a206c64f5e3cf7c220484a89732,company,https://s.yimg.com/rz/stage/p/yahoo_finance_en-US_h_p_finance_2.png
AAPL,2026-04-08,Apple unveils shocking Nvidia move,"Apple (AAPL) just made a shocking move. It approved a third-party driver for Apple Silicon Macs, Tom's Hardware reported. Although some may view the change as minor, it could potentially create a significant opportunity for Nvidia (NVDA) in the AI space. Apple’s (AAPL) closed ecosystem is a ...",Yahoo,https://finnhub.io/api/news?id=97b0ff1000b4a89080738b3a7780a4a1c19bdf0ff369d29e06eb0ebfa85b0883,company,https://s.yimg.com/rz/stage/p/yahoo_finance_en-US_h_p_finance_2.png
AAPL,2026-04-08,JPMorgan vs. Bank of America: Wall Street Has a Clear Favorite Stock Right Now,"JPMorgan Chase (NYSE:JPM) and Bank of America (NYSE:BAC) closed out 2025 with results that tell two distinct stories. JPMorgan made a headline bet on the Apple (NASDAQ: AAPL) Card while posting record wealth and payments revenue while Bank of America delivered its fifth consecutive quarter of rising net interest income, with a CEO who called ... JPMorgan vs. Bank of America: Wall Street Has a Clear Favorite Stock Right Now",Yahoo,https://finnhub.io/api/news?id=3852be48c9db07f8374799cb5fe0e14f1ccfb8f25922852dc522fee6052b4771,company,https://s.yimg.com/rz/stage/p/yahoo_finance_en-US_h_p_finance_2.png
AAPL,2026-04-08,"Anthropic Launches Project Glasswing With Amazon, Apple, Microsoft To Test Mythos AI",Tech partners gain early access to Anthropic's unreleased Mythos model to identify vulnerabilities and shape safeguards before any broader rollout.,Yahoo,https://finnhub.io/api/news?id=9d8b869d0695b0321351d0dfcb1cb47d63b802094e4035276809175a4bc737cd,company,https://s.yimg.com/rz/stage/p/yahoo_finance_en-US_h_p_finance_2.png
AAPL,2026-04-08,Apple stock is the new retail investor darling,Apple catches a whiff of retail investor buying.,Yahoo,https://finnhub.io/api/news?id=028171e5d234768e865d2d25bc9111537cd264d0bb8b45c29a9aa9786f234847,company,https://s.yimg.com/rz/stage/p/yahoo_finance_en-US_h_p_finance_2.png
AAPL,2026-04-08,Why Palo Alto Networks (PANW) Is Up 6.0% After Joining Anthropic’s Project Glasswing Cybersecurity Alliance,"In early April 2026, Anthropic announced Project Glasswing, a cybersecurity alliance that includes Palo Alto Networks, AWS, Apple, Google, Microsoft, NVIDIA, Cisco, CrowdStrike, JPMorganChase and others, giving them access to its unreleased Claude Mythos Preview AI model to hunt and fix software vulnerabilities at scale. The initiative highlights growing concern that advanced AI can discover and exploit critical flaws across major operating systems and browsers faster than most human...",Yahoo,https://finnhub.io/api/news?id=7b4100657bc035236c30b58f78fd62939c6daacf1ec2f38c58c6ce24493f43c1,company,https://s.yimg.com/rz/stage/p/yahoo_finance_en-US_h_p_finance_2.png
AAPL,2026-04-08,Did Foldable iPhone Delays and China AI Patent Loss Just Shift Apple's (AAPL) Investment Narrative?,"In recent days, Apple has faced reports of engineering setbacks that could push back production and shipments of its first foldable iPhone, while China’s Supreme People’s Court rejected Apple’s attempt to invalidate Xiao-I’s core AI patents, cementing a key legal defeat in a critical market. Together, these developments highlight both execution risk in Apple’s next major hardware category and rising intellectual-property constraints around AI features in its China-focused ecosystem. We’ll...",Yahoo,https://finnhub.io/api/news?id=a6d600523cbaeca84fc5bcfa6b020a3286d37347f5e909b91a8053062ae6dd00,company,https://s.yimg.com/rz/stage/p/yahoo_finance_en-US_h_p_finance_2.png
AAPL,2026-04-08,Apple Plans September Foldable iPhone Launch Despite Earlier Delay Concerns,"Sources say Apple still targets September debut alongside iPhone 18 Pro models, with initial supply possibly limited due to display complexity.",Yahoo,https://finnhub.io/api/news?id=d48e982501136de571d00d1e0ccc1f654bd030696e7a1ef594fe2bb6eedc1eac,company,https://s.yimg.com/rz/stage/p/yahoo_finance_en-US_h_p_finance_2.png
AAPL,2026-04-08,Anthropic develops AI ‘too dangerous to release to public’,"Silicon Valley start-up Anthropic has restricted access to its latest AI system, saying it is currently too dangerous to release to the public.",Yahoo,https://finnhub.io/api/news?id=b929067a294a8307b3f863f51a9792a9f7d23d9cfb1a4667c2b86e7f94c31adb,company,https://s.yimg.com/rz/stage/p/yahoo_finance_en-US_h_p_finance_2.png
AAPL,2026-04-08,"Global Chaos, AI Fears Help Tech’s Dividend Stocks Beat Market","(Bloomberg) -- An uncertain economy and dangerous geopolitical backdrop have investors buying into technology’s most popular haven trade: dividend-rich telecommunications stocks.After a dismal 2025, telecom is one of this year’s top performing sectors in the S&P 500 Index, rising more than 7% while the broad benchmark is down about 1%. Shares of Verizon Communication Inc. are up 16% in 2026, and AT&T Inc. has gained 10%. Meanwhile, the Nasdaq 100 Index fell into a correction in March, and a Bloo",Yahoo,https://finnhub.io/api/news?id=ca0343d1820087031320102420e32ca2a620a9cd9ff7fc3eaa1727ef19f70334,company,https://s.yimg.com/rz/stage/p/yahoo_finance_en-US_h_p_finance_2.png
AAPL,2026-04-08,"Apple's Foldable iPhone Still Set For Fall Launch, Analysts Say","Apple's rumored foldable iPhone is still on schedule for a fall launch, analysts say. Apple stock rose Wednesday.",Yahoo,https://finnhub.io/api/news?id=3428e36e604b7e55c2cbf93793297a24b5d05335453092b6293ed71aef84d0fa,company,https://s.yimg.com/rz/stage/p/yahoo_finance_en-US_h_p_finance_2.png
AAPL,2026-04-08,Analysts Remain Constructive on Apple (AAPL) Amid Expectations for Market Share Gain,"Apple Inc. (NASDAQ:AAPL) is included in our list of the 14 hedge fund favorites with strong setup in 2026. As of April 3, 2026, roughly 70% of covering analysts maintain bullish ratings on Apple Inc., and the consensus price target of $300.00 implies over 17% upside. On March 18, 2026, Bernstein SocGen Group reaffirmed its […]",Yahoo,https://finnhub.io/api/news?id=bc7048c9a802ffb11e95216f2675bcf35f0659a7cfe632145a54917891d36311,company,https://s.yimg.com/rz/stage/p/yahoo_finance_en-US_h_p_finance_2.png
AAPL,2026-04-08,Goldman Sachs Cautious on QUALCOMM (QCOM) Amid Key Customer Losses,"QUALCOMM Incorporated (NASDAQ:QCOM) is one of the 7 most oversold data center stocks to invest in. Analysts’ views on Qualcomm Incorporated (NASDAQ:QCOM) remain divided as of April 1, 2026, with roughly 60% of covering analysts holding mixed ratings. Yet the $150 consensus price target implies roughly 20% upside. Recently, analysts at Goldman Sachs discussed QUALCOMM […]",Yahoo,https://finnhub.io/api/news?id=d72cabf001ccb8e67aea2da61a9ddee402203461798907460f95fea812729e0b,company,https://s.yimg.com/rz/stage/p/yahoo_finance_en-US_h_p_finance_2.png
AAPL,2026-04-08,SoundHound Stock Plunges 43% in 3 Months: Buy the Dip or Wait Longer?,"SOUN stock dips 18.5% in a month as AI volatility bites, even with 59% Q4 revenue growth and forward P/S 11.57X.",Yahoo,https://finnhub.io/api/news?id=efe12f01cf60fe985505c421cb0dbc0d1984f20419a7ac1b7dcbffd72ae1c5d1,company,https://s.yimg.com/rz/stage/p/yahoo_finance_en-US_h_p_finance_2.png
AAPL,2026-04-08,Buffett Regrets Apple Sale As Berkshire Rethinks Stakes And Insurance Risk,"Warren Buffett has expressed regret over the timing of Berkshire Hathaway's sale of Apple shares, while keeping Apple as a core holding. Despite stepping down as CEO, Buffett remains involved in capital allocation decisions at NYSE:BRK.B. Berkshire is reassessing its position in both Apple and Kraft Heinz, signaling a shift in how it treats key equity stakes. The company is also participating in a US backed insurance consortium providing coverage for ships in the Strait of Hormuz. Berkshire...",Yahoo,https://finnhub.io/api/news?id=218e548b05e6f061ee69c9b235c43ed1538661cc52a823b0e10591c91b081839,company,https://s.yimg.com/rz/stage/p/yahoo_finance_en-US_h_p_finance_2.png
AAPL,2026-04-08,"Company News for Apr 8, 2026","Companies in The News Are: AAPL,INTC,TSLA,UNH,XOM",Yahoo,https://finnhub.io/api/news?id=631e31012e8e1bc37a67bb1c22ac252cf748fdf0b2faa9440ccd9d109d66b39f,company,https://s.yimg.com/rz/stage/p/yahoo_finance_en-US_h_p_finance_2.png
AAPL,2026-04-08,Apple: Everyone's Wrong About The Delay,"Apple Inc. stock slid on foldable iPhone delay reports. Get analysis on Appleâs pricing edge amid a memory crisis, ASP upside, and more. Click for this AAPL update.",SeekingAlpha,https://finnhub.io/api/news?id=d2134b994b9b3d947672f1dbb71b8e9d0cf341004a66ebf6bff06ce640ceb233,company,https://static.seekingalpha.com/cdn/s3/uploads/getty_images/1460225556/image_1460225556.jpg?io=getty-c-w1536
AAPL,2026-04-08,DGRO: Buying The Best Sector Through The Best-Built Dividend Growth ETF,"Initiate a Buy on iShares Core Dividend Growth ETF (DGRO): quality dividend growth, overweight financials, defensiveness, and long-term upside.",SeekingAlpha,https://finnhub.io/api/news?id=6abdd4da19f3e04d18475f82a72ecd2e2a2a648e7431361defb9c71529de568f,company,https://static.seekingalpha.com/cdn/s3/uploads/getty_images/1972341389/image_1972341389.jpg?io=getty-c-w1536
AAPL,2026-04-08,"CoreWeave and Nebius Have Outperformed Every ""Magnificent Seven"" Artificial Intelligence (AI) Stock This Year. Can It Last?","The ""Magnificent Seven"" group has performed poorly in 2026.",Yahoo,https://finnhub.io/api/news?id=311e98e05e283d95d01e1d59d77f8bbb50e583c51950c7ad93956971d5585ffd,company,https://s.yimg.com/rz/stage/p/yahoo_finance_en-US_h_p_finance_2.png
AAPL,2026-04-08,Apple iPhone Sales Stay Strong Globally,Rising demand and pricing trends point to solid momentum ahead of earnings.,Yahoo,https://finnhub.io/api/news?id=ccb6dd7e324fa11a345836b769767f0c1391cd7089905ecc136356236f391f96,company,https://s.yimg.com/rz/stage/p/yahoo_finance_en-US_h_p_finance_2.png
AAPL,2026-04-08,AAPL: Apple Stock Drops on Foldable iPhone Delay News,Apple Stock Dips. Foldable iPhone Pushback Raises Questions,Yahoo,https://finnhub.io/api/news?id=b93e9a2e542355250fdcacdd3132e867e1cba6401f66ae869a9fcea3a05e5858,company,https://s.yimg.com/rz/stage/p/yahoo_finance_en-US_h_p_finance_2.png
AAPL,2026-04-08,Anthropic Rolls Out Mythos AI to Select Cyber Partners,New AI security model highlights both defensive potential and governance concerns,Yahoo,https://finnhub.io/api/news?id=2630bbf88f5fa14c4bb87836319b5f19cd18aade86bce4546ba1b2fe822606c1,company,https://s.yimg.com/rz/stage/p/yahoo_finance_en-US_h_p_finance_2.png
AAPL,2026-04-08,SpaceX Valuation Push Tests Limits of Growth Premium,IPO demand builds as investors chase exposure to space and AI,Yahoo,https://finnhub.io/api/news?id=13a173f4cfefd067f7c4e56bda05737812b583eefe5726435aaa7d3188edab9f,company,https://s.yimg.com/rz/stage/p/yahoo_finance_en-US_h_p_finance_2.png
AAPL,2026-04-08,"Dow Jones Futures Spike 1,300 Points, Oil Prices Dive On Trump-Iran Ceasefire; What To Do Now","Dow Jones futures jumped, oil prices dived. President Trump agreed to halt Iran attacks for two weeks. Iran will open the Strait of Hormuz, with conditions.",Yahoo,https://finnhub.io/api/news?id=4755c20cc2c0bda763a230224be22084133571b6d1514d7dcf821530c339dd72,company,https://s.yimg.com/rz/stage/p/yahoo_finance_en-US_h_p_finance_2.png
AAPL,2026-04-08,Cybersecurity Stocks Climb Amid Anthropic's Project Glasswing Launch,"Many cybersecurity firms will join Anthropic's Project Glasswing, after cyber stocks tumbled earlier this year on AI disruption fears.",Yahoo,https://finnhub.io/api/news?id=78b83bc8034fc6e49fa530071040d1ba5f6c96ad23ff6026cc950afcd5d472d1,company,https://s.yimg.com/rz/stage/p/yahoo_finance_en-US_h_p_finance_2.png
AAPL,2026-04-08,High Dividends Turn Telecom Stocks Into Market’s New Haven Play,"(Bloomberg) -- An uncertain economy and dangerous geopolitical backdrop have investors buying into technology’s most popular haven trade: dividend-rich telecommunications stocks.After a dismal 2025, telecom is one of this year’s top performing sectors in the S&P 500 Index, rising 9.6% while the broad benchmark is down 3.3%. Shares of Verizon Communication Inc. are up more than 19% in 2026, and AT&T Inc. has gained 13%. Meanwhile, the Nasdaq 100 Index fell into a correction in March, and a Bloomb",Yahoo,https://finnhub.io/api/news?id=538c811920350a67523b835f741e923eaf2620dc007fe2bbbed8af4511ac95e5,company,https://s.yimg.com/rz/stage/p/yahoo_finance_en-US_h_p_finance_2.png
AAPL,2026-04-08,Gary Black Wants Tesla To Follow Apple's Footsteps To Boost Its FSD Subscriptions,"Investor Gary Black of The Future Fund LLC shared on Sunday that he hopes Tesla Inc. would follow Apple Inc.‘s marketing strategy for its Full Self-Driving (FSD) system. Full Self-Driving Is The Best Autonomous System In a response to influencer Whole Mars Catalog‘s post on X, which outlined that FSD’s $99/month subscription would become appealing once customers tried it out. “FSD is the best fully autonomous product on the market,” he said, but lamented that nobody other than Tesla fans knew ab",Yahoo,https://finnhub.io/api/news?id=2919ac134031dd4f0c848b3ebc17954d61caca75089337696c3980aa71cdebc9,company,https://s.yimg.com/rz/stage/p/yahoo_finance_en-US_h_p_finance_2.png
AAPL,2026-04-08,How Can Meta Stock Fall 30%?,"Meta Platforms (META) is currently riding a wave of massive ad revenue acceleration. As of early 2026, the company has reported advertising revenue growth in the 22% to 26% range, fueled by sophisticated AI-driven targeting and the aggressive monetization of Reels and WhatsApp. However, market leadership at this scale is difficult to maintain.",Yahoo,https://finnhub.io/api/news?id=21f793e91e41fc7b04f8b8013f42e6ecd7e3e997046a1edfe3a446cdf8c76c54,company,https://s.yimg.com/rz/stage/p/yahoo_finance_en-US_h_p_finance_2.png
AAPL,2026-04-08,ETO: Expect Volatility If Inflation Surges This Summer,"The Eaton Vance Tax-Advantaged Global Dividend Opportunities Fund (ETO) offers a 7.63% yield, primarily through a portfolio heavily weighted toward equities. Read the full CEF analysis here.",SeekingAlpha,https://finnhub.io/api/news?id=5a5f2a0f06ea0e70b32162edd6bf2ab068d0cbcd612acd4baa09cc250c63ea80,company,https://static.seekingalpha.com/cdn/s3/uploads/getty_images/1214399079/image_1214399079.jpg?io=getty-c-w1536
AAPL,2026-04-08,Alphabet: Q1 Is The Moment Of Truth,"Alphabet Inc. remains a Strong Buy: Q4 revenue +18%, Cloud +48% with $240B backlog. Click for this look at recent developments around GOOGL stock in this update.",SeekingAlpha,https://finnhub.io/api/news?id=38e22a3c328b4188ace10a93c2dce40d9574de5a1f5abf12ed947973234ca058,company,https://static.seekingalpha.com/cdn/s3/uploads/getty_images/2211981905/image_2211981905.jpg?io=getty-c-w1536
AAPL,2026-04-08,Mag 7 Stocks Melt Up After Ceasefire—Wall Street Cheers Truce as Mega Caps Rally,"Mag 7 stocks, including Meta, Tesla and Apple, rally as the US-Iran ceasefire lowers oil prices and bond yields.",Benzinga,https://finnhub.io/api/news?id=8da2d892c2141e83d203efc6a246ad29b6823a910f61c854f6150700780b2a12,company,https://cdn.benzinga.com/files/images/story/2026/04/08/wall-street-bull-midjourney.png?width=2048&height=1536
AAPL,2026-04-08,Broadcom Is Repeating Its Apple Playbook — But This Time It's AI,"Broadcom stock mirrors its Apple playbook as Google AI deals lock in multi-year revenue visibility, strengthen its long-term growth outlook.",Benzinga,https://finnhub.io/api/news?id=579d3332de6c2c6335e7cee052dee1a7564c4ae4eb92f2b319095f9e1dc2e9c9,company,https://cdn.benzinga.com/files/images/story/2026/04/08/Broadcom-Inc-.jpeg?width=2048&height=1536
AAPL,2026-04-08,"Iran ceasefire, Delta earnings, the Navy's retail woes and more in Morning Squawk",Here are five key things investors need to know to start the trading day.,CNBC,https://finnhub.io/api/news?id=8048515809ac4373830214c6b13b3f73e232b5c7f87a96ecf7a3474929c42aee,company,https://image.cnbcfm.com/api/v1/image/108287471-1775562180084-108287471-1775499466971-gettyimages-2269555129-TRUMP_IRAN_NYSE.jpg?v=1775652714&w=1920&h=1080
AAPL,2026-04-08,"Nvidia, Apple, and Alphabet Could Help This Marvelous Vanguard ETF Turn $250,000 Into $1 Million After the Stock Market Sell-Off",Investors have an opportunity to buy a basket of America's most valuable stocks at a discount.,Yahoo,https://finnhub.io/api/news?id=4fdd5031f72f8a93a5ed0e2397b4268008d4ed63a507a0a98a674e053448196e,company,https://s.yimg.com/rz/stage/p/yahoo_finance_en-US_h_p_finance_2.png
AAPL,2026-04-08,Apple Kills Mini-LED Era: New 2026 MacBook Pros To Trigger 33% OLED Explosion,Apple&#39;s (AAPL) upcoming OLED MacBook Pro is set to dominate the high-end laptop market in 2026. Discover how Apple is driving a 33% surge in OLED demand despite rising costs.,Benzinga,https://finnhub.io/api/news?id=1207f223547effd1796ff54e51ae0c7313d3c8a6271e7ac344cdd4e749a05d4e,company,https://cdn.benzinga.com/files/images/story/2026/04/08/Bangkok--Thailand--February-25--2026-A-P.jpeg?width=2048&height=1536
AAPL,2026-04-08,"Apple faces challenges amid geopolitical strife, says Deepwater's Gene Munster","Gene Munster, Deepwater Asset Management managing partner, joins 'Squawk Box' to discuss what tech stocks are well-positioned today, his outlook on tech stocks, a potential SpaceX IPO, and more.",CNBC,https://finnhub.io/api/news?id=afdf03a318d54b4a267dbebfb857e872d35c7c7e087d1b27e4674ccdd37e0adf,company,https://image.cnbcfm.com/api/v1/image/108288530-17756474751775647471-45116415174-1080pnbcnews.jpg?v=1775647474&w=1920&h=1080
AAPL,2026-04-08,Broadcom Joins AI Cybersecurity Drive As Valuation And Growth Draw Focus,"Broadcom has joined Project Glasswing, an industry wide cybersecurity initiative focused on using advanced AI models to protect critical software infrastructure. The collaboration brings together Broadcom, Amazon, Anthropic, Apple, Google, Microsoft, Nvidia and others to apply AI to vulnerability detection and defensive security tools. The move extends Broadcom's role beyond its core semiconductor and AI chip business into infrastructure software and cybersecurity partnerships. For...",Yahoo,https://finnhub.io/api/news?id=7d2a25cfd9be418343ad3667adef307fe33c88281180cd52580bb96c633b35af,company,https://s.yimg.com/rz/stage/p/yahoo_finance_en-US_h_p_finance_2.png
AAPL,2026-04-08,Apple's Foldable iPhone Reportedly Remains On Track For September Debut,"Apple Inc. (AAPL) shares recovered as reports confirm its $2,000 foldable iPhone is slated for a September launch, coinciding with a broader market rally.",Benzinga,https://finnhub.io/api/news?id=fc5ffcb3dc1d59d9c2ae053638bda7769c48a9d9e0d14d60f22528c0b2aa2229,company,https://cdn.benzinga.com/files/images/story/2026/04/08/Beijing--China---July-21--2023-Apple-Log.jpeg?width=2048&height=1536
AAPL,2026-04-08,"Ceasefire, Collapsing Oil, and a Chipmaker on Fire, Wall Street Wednesday Opens on a Different Planet","Just hours before Trump's deadline to ""wipe out Iranian civilization"" expired, Washington and Tehran agreed to a two-week ceasefire brokered by Pakistan. Oil fell off a cliff. Futures surged. And that was before Broadcom decided to steal the spotlight with the most consequential AI chip deal of 2026.",ChartMill,https://finnhub.io/api/news?id=69cd34385ddb7d071b1bc36e65dc2aaf9040cb623daaec572d0c40bcccc3632e,company,https://www.chartmill.com/images/uploads/THUMBNAILS_CHARTMILL_1000_528_14_6f54b33363.webp
AAPL,2026-04-08,Markets Party On Trump's Ceasefire — But For How Long?,U.S. stocks surge after Trump pauses Iran strikes as tech and chip stocks rally and oil prices plunge on easing tensions,Benzinga,https://finnhub.io/api/news?id=8d890fbc21c06f988cf2662dd0b9e7e00362948c9d21e6a2c6654b32df353099,company,https://cdn.benzinga.com/files/images/story/2026/04/08/Senior-Broker-Analyzing-Stock-Market-Dat.jpeg?width=2048&height=1536
AAPL,2026-04-08,3 Growth Stocks to Hold for the Next 20 Years,These stocks could be multidecade winners.,Yahoo,https://finnhub.io/api/news?id=cc4b4f008272dd07b190dede13ed6368e5578d78da5340d2b1448137d4d71f91,company,https://s.yimg.com/rz/stage/p/yahoo_finance_en-US_h_p_finance_2.png
