ticker,date,headline,summary,source,url,category,image
MSFT,2026-04-07,Is Microsoft Stock Going to $587? Wall Street Weighs In.,"The stock is sliding, but most analysts see a buying opportunity.",Yahoo,https://finnhub.io/api/news?id=991eccaf9bf8d7a4606c08f0367cd2f29bf3f7a4a992ec323ef26367c2ecd93b,company,https://s.yimg.com/rz/stage/p/yahoo_finance_en-US_h_p_finance_2.png
MSFT,2026-04-07,"Servpac offers Microsoft Azure Local to Hawaiʻi Government, Education & Businesses - a First for Hawai'i","Locally-owned Servpac announces its offering Microsoft Azure Local to Hawaiʻi government, education and businesses, allowing organizations throughout the islands to access Azure's cloud services while keeping data locally in Hawaiʻi to meet regulatory and compliance requirements.",Yahoo,https://finnhub.io/api/news?id=83e1175b088576f0571cdd1af4e6e005894dfda33bc437d46bf8d220bad92b04,company,https://s.yimg.com/rz/stage/p/yahoo_finance_en-US_h_p_finance_2.png
MSFT,2026-04-07,Anthropic launches new AI model to help fight cyberattacks,Private AI developer Anthropic (ANTH.PVT) is partnering with an array of Big Tech names for its Project Butterfly cybersecurity initiative that will help combat AI-empowered cyberattacks.Yahoo Finance Tech Editor Dan Howley joins Markets and Data Editor Jared Blikre to break down the headline.,Yahoo,https://finnhub.io/api/news?id=6b3a4ca318db21c27149037bdf0d8f902adcb2d661d34974a7168831616d10ab,company,https://s.yimg.com/rz/stage/p/yahoo_finance_en-US_h_p_finance_2.png
MSFT,2026-04-07,"Palo Alto, CrowdStrike Stocks Pop After Anthropic Announces Partnerships","‘AI models have reached a level of coding capability where they can surpass all but the most skilled humans at finding and exploiting software vulnerabilities,’ Anthropic says.",Yahoo,https://finnhub.io/api/news?id=2a63e429817a0bfccc55aeab9c771ecd439db3137738f7e32c5216e4970c598a,company,https://s.yimg.com/rz/stage/p/yahoo_finance_en-US_h_p_finance_2.png
MSFT,2026-04-07,Dimon Says AI Capital Spending Will Hit $725 Billion in 2026. Here Are the Sectors That Will Win and the Ones That Will Be Left Behind,That spending spree will lift some AI stocks while generating fierce headwinds for others.,Yahoo,https://finnhub.io/api/news?id=b932d7b04fdcd5c10394cc06acaf0ea8f85f1950cfd2d3e27f15512d1d830f3a,company,https://s.yimg.com/rz/stage/p/yahoo_finance_en-US_h_p_finance_2.png
MSFT,2026-04-07,Anthropic pulls ahead of OpenAI as revenue race heats up,"Anthropic, the artificial intelligence company backed by Google, Amazon, and Microsoft, has crossed $30 billion in annualized revenue, outpacing OpenAI for the first time, according to Jefferies analysts. The surge comes after Anthropic added roughly $21 billion in net new annualized revenue...",Yahoo,https://finnhub.io/api/news?id=9dfdcc48988470936b8d6de8bd57e17faa2e50dd7013d5c34bc170646bb76979,company,https://s.yimg.com/rz/stage/p/yahoo_finance_en-US_h_p_finance_2.png
MSFT,2026-04-07,"As Bulls and Bears Battle Over AI, $350 Is the Key Number to Watch for Microsoft Stock","Microsoft (MSFT) is undergoing a significant market repricing as its exclusive AI leadership premium fades amid intensifying competition from Google, yet the company’s underlying fundamentals remain exceptionally strong with net income surging nearly 39% year-over-year.",Yahoo,https://finnhub.io/api/news?id=bed8d1a5a8d93479011a9794afb5ef7a69d8495550f7560ef55f78797c902229,company,https://s.yimg.com/rz/stage/p/yahoo_finance_en-US_h_p_finance_2.png
MSFT,2026-04-07,Nerdio Announces a Strategic Technology Alliance with Nutanix for End-User Computing Modernization,"Nerdio and Nutanix redefine end-user computing in the artificial intelligence (AI) era with a unified hybrid cloud alliance built for Microsoft Azure Virtual DesktopChicago, IL, April 07, 2026 (GLOBE NEWSWIRE) -- Nerdio, the leading automated end-user computing (EUC) platform for Microsoft Cloud technologies today announced a strategic technology alliance with Nutanix, a leader in hybrid multi-cloud computing, to aid organizations in their modernization efforts. Nerdio is collaborating with Nuta",Yahoo,https://finnhub.io/api/news?id=462804848958f6a2e73bfc35a01f9c3896a74e5f2daa4062007d217f56f2977e,company,https://s.yimg.com/rz/stage/p/yahoo_finance_en-US_h_p_finance_2.png
MSFT,2026-04-07,Google CEO Sundar Pichai says 'AI shift' opens opportunities to invest in startups,"Alphabet is in investor in some of the highest-valued private companies, including SpaceX, Anthropic and Stripe. ",CNBC,https://finnhub.io/api/news?id=24d312eafb4fa8b143dbc5eb70a7dc8e214274ffb425bd4bdd0b29962ca7cc86,company,https://image.cnbcfm.com/api/v1/image/108198794-1757946595048-gettyimages-2217999139-BLOOMBERG_TECH.jpeg?v=1775592738&w=1920&h=1080
MSFT,2026-04-07,Microsoft In Downtrend Amid War Woes; Is Microsoft A Buy Or Sell Now?,Microsoft stock remains in a downtrend after selling off on earnings in January. The stock holds an RS Rating of just 18.,Yahoo,https://finnhub.io/api/news?id=10516f6f85cd05f0474da4460d951b35b421d245de5b5eb2a2c948225fb7c088,company,https://s.yimg.com/rz/stage/p/yahoo_finance_en-US_h_p_finance_2.png
MSFT,2026-04-07,Hyperscalers Shift To Arm Chips What It Means For AMD Valuation,"Major cloud providers are reallocating AI server spending from legacy x86 CPUs by NasdaqGS:AMD and Intel toward proprietary Arm-based chips. Arm CPUs are projected to account for most custom AI ASIC deployments by 2029, signaling a shift in how hyperscalers design their data center infrastructure. This transition affects demand patterns for traditional x86 data center processors used in large scale AI and cloud workloads. For you as an investor looking at NasdaqGS:AMD, this shift comes at a...",Yahoo,https://finnhub.io/api/news?id=4167060a896708e90fa9adde3a060c95247fb44288f035fbeb9606e51a7735d7,company,https://s.yimg.com/rz/stage/p/yahoo_finance_en-US_h_p_finance_2.png
MSFT,2026-04-07,"Microsoft, Spotify, Viking Added to BofA US 1 List",Bank of America names the three stocks among its top U.S.-listed investment ideas.,Yahoo,https://finnhub.io/api/news?id=db2c0656a8810fc11a84e784fba506ecbb251eb89cc80829671c0bbdc90d859c,company,https://s.yimg.com/rz/stage/p/yahoo_finance_en-US_h_p_finance_2.png
MSFT,2026-04-07,"Anthropic launches cybersecurity partnership with Nvidia, Microsoft, other tech giants after latest AI model finds 'thousands' of previously unknown bugs","Anthropic launched a cybersecurity partnership with companies including Amazon, Apple, and Microsoft on Tuesday.",Yahoo,https://finnhub.io/api/news?id=b201aa14f66450099d73574a2ea3ab15e6d59138f86ca4c1014f015934c1b134,company,https://s.yimg.com/rz/stage/p/yahoo_finance_en-US_h_p_finance_2.png
MSFT,2026-04-07,Anthropic touts AI cybersecurity project with Big Tech partners,"Anthropic on Tuesday announced an initiative with major technology companies, including Amazon.com, Microsoft and Apple, that lets partners preview ‌an advanced model with cybersecurity capabilities developed by the AI startup.  Under ‌its ""Project Glasswing"", select organizations will be allowed to use the startup's unreleased and general-purpose AI model, ""Claude ​Mythos Preview"", for defensive cybersecurity work, Anthropic said.  Other partners include CrowdStrike, Palo Alto Networks, Google and Nvidia.",Yahoo,https://finnhub.io/api/news?id=27d7ec1d5dbd253807f60546bf78f8f116455468f6c3c5eff1d9b1d8a3f0c393,company,https://s.yimg.com/rz/stage/p/yahoo_finance_en-US_h_p_finance_2.png
MSFT,2026-04-07,Anthropic Set to Preview Powerful ‘Mythos’ Model to Ward Off AI Cyberthreats,Anthropic is taking steps to arm some of the world’s biggest technology companies with tools to find and patch bugs in their hardware and software.,Yahoo,https://finnhub.io/api/news?id=aa0d5afd417b523294cb04470e460482bdcc99176b4f4a254026f74cc6b65b6c,company,https://s.yimg.com/rz/stage/p/yahoo_finance_en-US_h_p_finance_2.png
MSFT,2026-04-07,"Anthropic Lets Apple, Amazon Test More Powerful Mythos AI Model","(Bloomberg) -- Anthropic PBC is letting tech firms access a more powerful, unreleased artificial intelligence model to help prepare for possible cyberattacks that might result from the company making the advanced AI system more widely available.Anthropic said Tuesday that it’s forming an initiative called Project Glasswing with Amazon.com Inc., Apple Inc., Microsoft Corp., Cisco Systems Inc. and other organizations. The companies will get access to a new Anthropic model called Mythos to hunt for",Yahoo,https://finnhub.io/api/news?id=d6a6ef3b08edf62d41648542149c53f452511919753c9c00516d455f3eb437d0,company,https://s.yimg.com/rz/stage/p/yahoo_finance_en-US_h_p_finance_2.png
MSFT,2026-04-07,"Anthropic Teams With Apple, Microsoft And Nvidia To Test Latest Cybersecurity Tech","Anthropic has rolled out Project Glasswing, a security-focused collaboration allowing companies to use an unreleased AI model.",Benzinga,https://finnhub.io/api/news?id=b30c3d26fda844a7cb945f1f2a1a44ad316aff91ab9f05ec42bd576f463238b2,company,https://cdn.benzinga.com/files/images/story/2026/04/07/October-11--2023--Brazil--In-This-Photo-_1.jpeg?width=2048&height=1536
MSFT,2026-04-07,Goldman has very good news for beaten-down Microsoft investors,"If you own Microsoft, this year has tested your patience in ways that probably feel unfair. While Nvidia and some of the other tech giants kept grabbing the AI headlines, Microsoft quietly became the worst performer in the Magnificent Seven this year, dropping about 23% in the quarter ending March ...",Yahoo,https://finnhub.io/api/news?id=aa69e00cad8bc9d522cc8b1eec5047efea32c8ac0954056608ad04e333d59267,company,https://s.yimg.com/rz/stage/p/yahoo_finance_en-US_h_p_finance_2.png
MSFT,2026-04-07,Arista Networks Gets Upgraded. AI Hyperscalers Could Push the Stock to a Record.,Arista Networks  stock advanced Tuesday after receiving a bullish upgrade.  Rosenblatt Securities says the company’s relationships with major AI hyperscalers should see a big payoff soon.  Arista Networks  broadly sells solutions for artificial-intelligence data centers and counts  Meta Platforms  and  Microsoft  among among its clients.,Yahoo,https://finnhub.io/api/news?id=860e09afd6f9d33bf79bf67c468ef0aed616484d4278a8623f13a70a4923b5c4,company,https://s.yimg.com/rz/stage/p/yahoo_finance_en-US_h_p_finance_2.png
MSFT,2026-04-07,Elon Musk seeks ouster of OpenAI CEO Sam Altman as part of lawsuit,Elon Musk is seeking to have OpenAI CEO Sam Altman and President Greg Brockman removed from their roles as officers in the company as part of a lawsuit. ,CNBC,https://finnhub.io/api/news?id=027b09c87ff43c20f00938fda47eb417b07dd63226294dcad9ea28c131760b62,company,https://image.cnbcfm.com/api/v1/image/108249952-1767884969362-gettyimages-2246892016-AFP_84JG4JH.jpeg?v=1775594381&w=1920&h=1080
MSFT,2026-04-07,"JEDEC® Announces May 2026 Forums Focused on Next-Generation Memory for AI, Server, Cloud, and Mobile Computing","ARLINGTON, Va., April 07, 2026--JEDEC Solid State Technology Association, the global leader in the development of standards for the microelectronics industry, today announced that it is hosting a Mobile/Client/Edge Forum on Tuesday, May 12 and a Server/Cloud Computing/AI Forum on Wednesday, May 13 in San Jose, CA. Advance registration is required and space is limited. For more information and registration, visit the JEDEC website.",Yahoo,https://finnhub.io/api/news?id=c3a99003e1ffc37a34c49c77b0f060705a7834eadc87bfeba06d95204f7fcb59,company,https://s.yimg.com/rz/stage/p/yahoo_finance_en-US_h_p_finance_2.png
MSFT,2026-04-07,Anthropic Poaches Microsoft Executive to Lead Infrastructure,"(Bloomberg) -- Anthropic PBC has hired a senior leader from Microsoft Corp. to lead its push to establish the infrastructure needed to support growing adoption of its artificial intelligence services. Eric Boyd will serve as head of infrastructure at Anthropic, according to a post on his LinkedIn Tuesday. “AI is accelerating at an incredible pace,” he wrote. “The impact of Claude Code in the last 6 months, and particularly the last two months, just shows the power of what is possible.”Anthropic",Yahoo,https://finnhub.io/api/news?id=24a257ce6a2409f5fd63748c1cc60bbb851112ee4eba2e77ec8241c8a32bc59c,company,https://s.yimg.com/rz/stage/p/yahoo_finance_en-US_h_p_finance_2.png
MSFT,2026-04-07,"AI Data Center Energy Storage Market Outlook, 2030: AI Workloads and Faster Grid Interconnection Needs Driving the Market at 28-38% CAGR","Dublin, April 07, 2026 (GLOBE NEWSWIRE) -- The ""AI Data Center Energy Storage - How Workload Volatility and Grid Bottlenecks Are Creating a $4-6 Billion Market (2025-2030)"" has been added to ResearchAndMarkets.com's offering. The global energy storage market for AI data centers is poised to achieve $4.1-6.0 billion in annual revenue by 2030, experiencing a 28-38% compound annual growth rate from approximately $1.2 billion in 2025. This expansion is two to three times larger than prior UPS-centri",Yahoo,https://finnhub.io/api/news?id=88396d0765c1e95cb8fa62b0854d82b47a4ec68b200b850685bb9f7d110bf2e9,company,https://s.yimg.com/rz/stage/p/yahoo_finance_en-US_h_p_finance_2.png
MSFT,2026-04-07,"High Growth, Lower Valuations: Why Goldman Sachs Now Sees 'Opportunity' in Tech Stocks",The Wall Street firm says the technology sector has shown 'one of the worst' periods of relative underperformance compared with a world stock index excluding tech since the early 1970s.,Yahoo,https://finnhub.io/api/news?id=b808e2e534b7ba8c618b23c984484d6ce5527adddace25741d67c3efa33a6553,company,https://s.yimg.com/rz/stage/p/yahoo_finance_en-US_h_p_finance_2.png
MSFT,2026-04-07,All You Need to Know About Microsoft (MSFT) Rating Upgrade to Buy,"Microsoft (MSFT) has been upgraded to a Zacks Rank #2 (Buy), reflecting growing optimism about the company's earnings prospects. This might drive the stock higher in the near term.",Yahoo,https://finnhub.io/api/news?id=843eeb2d3657d2771d8ae2894aaa8342fb6c390639f45e10b11649d21d275002,company,https://s.yimg.com/rz/stage/p/yahoo_finance_en-US_h_p_finance_2.png
MSFT,2026-04-07,Gemini Falls Behind ChatGPT As Grok Disappears,"Sensor Tower’s “Top Charts” for downloads from the Apple App Store shows OpenAI in first place, followed by Google’s Gemini and Anthropic’s Claude. xAI’s Grok doesn’t make the top 25. The Apple App Store ranks the downloads in the same order, but Grok is in 22nd place. While the list does not show the popularity ... Gemini Falls Behind ChatGPT As Grok Disappears",Yahoo,https://finnhub.io/api/news?id=26fc5433604d6aa5ee6b67c08dd9cd11724c299aaa2c5d1ede4aea0e70facdd3,company,https://s.yimg.com/rz/stage/p/yahoo_finance_en-US_h_p_finance_2.png
MSFT,2026-04-07,The dividend yield on the S&P 500 is now at 50-year lows. Here's the biggest problem.,Where'd all the dividends go?,Yahoo,https://finnhub.io/api/news?id=34f7919e59bf3d9e4be8f1c510c360e5c046f19f26fb6873bdc1c5c1399fb114,company,https://s.yimg.com/rz/stage/p/yahoo_finance_en-US_h_p_finance_2.png
MSFT,2026-04-07,"Anthropic adds compute power with Google, Broadcom deals","The partnerships give CIOs confidence that model providers are acquiring the capacity to power enterprise AI, Gartner VP Analyst Alastair Woolcock said.",Yahoo,https://finnhub.io/api/news?id=c5e6c520b4fbc87697748384979052f6b250199daa7ba1bca48343094dc7db34,company,https://s.yimg.com/rz/stage/p/yahoo_finance_en-US_h_p_finance_2.png
MSFT,2026-04-07,Lebenthal: NVDA and Micron account for nearly all S&P tech earnings growth,"Here is a number worth sitting with: strip Nvidia and Micron out of Q1 S&P earnings and overall S&P earnings growth drops to roughly 3%. That came from James Lebenthal in a recent interview, and I haven’t stopped thinking about it since. Tech is expected to grow earnings roughly 30% this year, and virtually all ... Lebenthal: NVDA and Micron account for nearly all S&P tech earnings growth",Yahoo,https://finnhub.io/api/news?id=7352c73961ea7caf326b3ca5d083f067c7b525b7b1e86c294d0f08ecbdbcdc1d,company,https://s.yimg.com/rz/stage/p/yahoo_finance_en-US_h_p_finance_2.png
MSFT,2026-04-07,"eGain Announces Enterprise AI Platform Connectors for Copilot, Claude, Gemini, and Cursor","SUNNYVALE, Calif., April 07, 2026 (GLOBE NEWSWIRE) -- eGain (NASDAQ: EGAN) today announced new enterprise AI platform connectors that integrate Microsoft Copilot, Anthropic Claude, Google Gemini CLI, and Cursor with eGain AI Knowledge Hub, the company’s AI-powered knowledge management platform. The connectors allow organizations to ground these AI platforms in a single, governed knowledge source, so every AI model, agent, and agentic developer environment can use accurate, up-to-date knowledge r",Yahoo,https://finnhub.io/api/news?id=e16693f131ccf25d61c994bed559ba1e6b7f5a63824517da34533ae4ed090fc8,company,https://s.yimg.com/rz/stage/p/yahoo_finance_en-US_h_p_finance_2.png
MSFT,2026-04-07,IIT2026 CONFERENCE BRINGS GLOBAL THOUGHT LEADERS TO LONG BEACH,"The IIT2026 Global Conference is bringing together top minds in leading industries from the U.S. and India, from April 22-25 this year at the Long Beach Convention Center.",Yahoo,https://finnhub.io/api/news?id=469f91601d66f3365356205f784145eeda545307b4177a84c925b5bd5f0228e2,company,https://s.yimg.com/rz/stage/p/yahoo_finance_en-US_h_p_finance_2.png
MSFT,2026-04-07,"If Magnificent 7 Executives Don’t Believe In Their Stocks, Should You?","The Magnificent 7 — Apple (NASDAQ:AAPL), Amazon (NASDAQ:AMZN), Alphabet (NASDAQ:GOOG)(NASDAQ:GOOGL), Meta Platforms (NASDAQ:META), Microsoft (NASDAQ:MSFT), Nvidia (NASDAQ:NVDA), and Tesla (NASDAQ:TSLA) — have powered the market’s AI-driven rally, lifting their combined market capitalization past $20 trillion. Since the 2009 bottom, the group has delivered returns that dwarf the S&P 500’s 873% gain: Nvidia up 85,000%, Tesla ... If Magnificent 7 Executives Don’t Believe In Their Stocks, Should You",Yahoo,https://finnhub.io/api/news?id=37821a313d6869bde507792e36948554ee5ecbc6bd6c659800d23e75a22a0e70,company,https://s.yimg.com/rz/stage/p/yahoo_finance_en-US_h_p_finance_2.png
MSFT,2026-04-07,Magnificent Seven Are Cracking – Goldman Sees A Tech Value Opportunity That Hasn't Existed Since the 1970s,Goldman Sachs says tech valuations hit 50-year lows vs. the market. Info Tech is set to drive 87% of S&amp;P 500 EPS growth in Q1 2026.,Benzinga,https://finnhub.io/api/news?id=ee9765adf03f44d713bed4ae27085aac45e7303ca63a204ca56df186748115b0,company,https://cdn.benzinga.com/files/images/story/2026/04/07/Magnificent-Seven-stocks.jpeg?width=2048&height=1536
MSFT,2026-04-07,The App Killer: How 'Agentic AI' Is Turning Your Smartphone Into A Digital Employee,"Agentic AI is officially the next frontier, moving from &#34;talking&#34; to &#34;doing.&#34; Discover how Qualcomm and Google are building autonomous agents that plan your life and kill the need for traditional apps.",Benzinga,https://finnhub.io/api/news?id=5a31d031bb72efba822892f33a30bbf4042720392d421b86a69f04ac10966ac6,company,https://cdn.benzinga.com/files/images/story/2026/04/07/AI-Agents-Boost-Efficiency.jpeg?width=2048&height=1536
MSFT,2026-04-07,MSFT Deepens AI Strategy With New Foundational Models: What's Ahead?,"Microsoft deepens its AI push with three in-house models, boosting speed, voice realism and image generation as it ramps enterprise monetization.",Yahoo,https://finnhub.io/api/news?id=705e33ec4f30238eb47b91964139bb8849abf4e4ae6ba22bbc78aad72171c2cc,company,https://s.yimg.com/rz/stage/p/yahoo_finance_en-US_h_p_finance_2.png
MSFT,2026-04-07,IREN Limited Plunges 23% in 3 Months: Time to Hold or Fold the Stock?,"IREN's 23% slide in the past three months reflects near-term mining weakness, but its AI cloud pivot and GPU expansion support a hold stance for now.",Yahoo,https://finnhub.io/api/news?id=b4d4b0a4e065995a3bbe19086ef04ebde39b84d1858c66fffaa19c3c26b504d0,company,https://s.yimg.com/rz/stage/p/yahoo_finance_en-US_h_p_finance_2.png
MSFT,2026-04-07,Can IREN's 150K GPU Fleet Drive $3.7B AI Cloud ARR Target in 2026?,"IREN is betting on 150,000 GPUs to reach $3.7B AI cloud ARR by 2026, with $2.3B already under contract and more customer talks underway.",Yahoo,https://finnhub.io/api/news?id=e7ce133bad0c2812142fcb2754c0c9387cbcaa072c9f2bec01f9a24b7d952976,company,https://s.yimg.com/rz/stage/p/yahoo_finance_en-US_h_p_finance_2.png
MSFT,2026-04-07,Anthropic limits Mythos AI rollout over fears hackers could use model for cyberattacks,"Microsoft, Amazon, Apple, CrowdStrike, Palo Alto Networks and others will use the model as part of a new cybersecurity initiative called Project Glasswing.",CNBC,https://finnhub.io/api/news?id=a22680018799f56a28eaec884097027433d683e68d2027aed4a8dd28bbf749eb,company,https://image.cnbcfm.com/api/v1/image/108254385-17689274872026-01-20t124832z_629620600_rc205ja69ak1_rtrmadp_0_davos-meeting.jpeg?v=1775581111&w=1920&h=1080
MSFT,2026-04-07,"Tech valuations settle down, offering new opportunity for investors","In a new note published on Tuesday, Goldman Sachs strategist Peter Oppenheimer has found that the tech sector's (XLE) underperformance could be leading to some valuation opportunities for investors.B. Riley Wealth chief market strategist Art Hogan and Yahoo Finance Senior Reporter Brooke DiPalma examine what the software industry is signaling and how Magnificent Seven tech names have been the S&P 500's (^GSPC) biggest detractors in 2026.",Yahoo,https://finnhub.io/api/news?id=1db23751639be427827c90314b37edaa67c714351b6529a0fe1a5509c65aabf5,company,https://s.yimg.com/rz/stage/p/yahoo_finance_en-US_h_p_finance_2.png
MSFT,2026-04-07,VivoPower appoints former Microsoft AI leader to advisory council,"VivoPower PLC (NASDAQ:VIVO, FRA:51J) announced it has appointed artificial intelligence strategist Khadija Mustafa to its advisory council, as the company looks to expand its global footprint in AI-focused infrastructure. Mustafa brings more than two decades of experience in global technology...",Yahoo,https://finnhub.io/api/news?id=139e644dad78f1a050f8b94dbdeec9f30dc83502291a313a2708fde5f4841a8e,company,https://s.yimg.com/rz/stage/p/yahoo_finance_en-US_h_p_finance_2.png
MSFT,2026-04-07,"Wall Street Lunch: Mizuho Cuts Targets On Quantum Stocks, Not Optimism","Mizuho is dialing back its near-term enthusiasm on quantum computing, cutting price targets on D-Wave Quantum (QBTS), IonQ (IONQ) and Rigetti Computing (RGTI).",SeekingAlpha,https://finnhub.io/api/news?id=8bd5d2b34347fc3e871f0cebf4d49b797c841a680f8c7eb2542e2d0a2b60d85d,company,https://static.seekingalpha.com/cdn/s3/uploads/getty_images/1393512942/image_1393512942.jpg?io=getty-c-w1536
MSFT,2026-04-07,Microsoft (MSFT) Is Considered a Good Investment by Brokers: Is That True?,"Based on the average brokerage recommendation (ABR), Microsoft (MSFT) should be added to one's portfolio. Wall Street analysts' overly optimistic recommendations cast doubt on the effectiveness of this highly sought-after metric. So, is the stock worth buying?",Yahoo,https://finnhub.io/api/news?id=cff8f2395e1fd6457d853917db33572864cfb07b38eae999feb858c8a4171ee2,company,https://s.yimg.com/rz/stage/p/yahoo_finance_en-US_h_p_finance_2.png
MSFT,2026-04-07,Top 50 High-Quality Dividend Growth Stocks For April 2026,I track a universe of 50 high-quality dividend growth stocks to identify attractive entry points based on updated valuations and forward return estimates.,SeekingAlpha,https://finnhub.io/api/news?id=dd399a1ebcf93ffde6b1cafdb6d98b031daa8fef12c77c4357b44b1cac7b4eaa,company,https://static.seekingalpha.com/cdn/s3/uploads/getty_images/2256862219/image_2256862219.jpg?io=getty-c-w1536
MSFT,2026-04-07,"The Zacks Analyst Blog Highlights NVIDIA, Microsoft, IonQ and Rigetti Computing",NVIDIA leads AI-quantum supercycle bets as rising demand for hybrid computing and cybersecurity fuels stocks with over 50% upside potential.,Yahoo,https://finnhub.io/api/news?id=66a228e000f45a5ba36e76ccfaa8a24b4336030a3f547bed2f97ba4fdb8a22c9,company,https://s.yimg.com/rz/stage/p/yahoo_finance_en-US_h_p_finance_2.png
MSFT,2026-04-07,Udemy Expands End-to-End Certification Journey with Microsoft Certifications,"SAN FRANCISCO, April 07, 2026--Udemy (Nasdaq: UDMY), a global AI-powered skills acceleration platform, today announced the launch of an end-to-end certification journey with a significant expansion of its Microsoft Certification resources. Learners can now purchase more than 50 Microsoft certification exam vouchers directly via Udemy, creating a more accessible, end-to-end path from learning to certification. This strategic enhancement complements the more than 10,000 Microsoft courses Udemy has",Yahoo,https://finnhub.io/api/news?id=44d5924fdc8950464cfb041a2e9be0f855e85dab04752626b5b620127bced72e,company,https://s.yimg.com/rz/stage/p/yahoo_finance_en-US_h_p_finance_2.png
MSFT,2026-04-07,"Oil Surges To $115, Stocks Slide As Trump Deadline Looms: What's Moving Markets Tuesday?",Oil prices keep investors on the defensive. U.S. equities fell as WTI crude topped $115 on Trump&#39;s latest threat against Iran.,Benzinga,https://finnhub.io/api/news?id=30b067f530ea2f4579f3e8e36337cb47e3db30a42fcd3b11f167991f0ca41de1,company,https://cdn.benzinga.com/files/images/story/2026/04/07/Washington-D-c---Usa---April-7--2025-Uni_3.jpeg?width=2048&height=1536
MSFT,2026-04-07,"AWS teams working around the clock to keep Middle East services up after drone strikes, CEO says","The Iran war has hit Amazon data centers in the region, and the company is working around the clock on availability, cloud chief Matt Garman said.",CNBC,https://finnhub.io/api/news?id=b9e083d9ab4cee41c7571a78644942e636310edc2adae4d2d852f5d0b1a2e07b,company,https://image.cnbcfm.com/api/v1/image/108288067-1775579959551-MATT_GARMAN_2.png?v=1775580204&w=1920&h=1080
