ticker,date,headline,summary,source,url,category,image
NVDA,2026-04-08,Dell and HIVE partner to deploy Nvidia’s next-generation AI chips,Dell Technologies is expanding its presence in the artificial intelligence sector through a new agreement with HIVE Digital Technologies. The two companies are teaming up to build a new graphics processing unit (GPU) cluster designed to handle the most demanding digital tasks. This ...,Yahoo,https://finnhub.io/api/news?id=4c8448b2d72c192afd4d555803f095191c60006b906f7d4b2d0ba93bbf49e006,company,https://s.yimg.com/rz/stage/p/yahoo_finance_en-US_h_p_finance_2.png
NVDA,2026-04-08,"Oil, Geopolitics, and Growth: 3 Energy Stocks Worth Holding for 10 Years","Chevron, Enbridge, and Vistra will profit from the soaring demand for oil and energy.",Yahoo,https://finnhub.io/api/news?id=4072d51ae4127e92cce878a98e4bc3448574f2ce67d92fb9ca188282b6d91592,company,https://s.yimg.com/rz/stage/p/yahoo_finance_en-US_h_p_finance_2.png
NVDA,2026-04-08,3 Dividend Stocks Worth Buying More of While the Market Is Distracted,"Market volatility creates investing opportunities, and these three dividend stocks are good values today.",Yahoo,https://finnhub.io/api/news?id=62fefa3c3549043e3e9a66d8c239b789a39c5d1c2659e997a84ceb8c94890569,company,https://s.yimg.com/rz/stage/p/yahoo_finance_en-US_h_p_finance_2.png
NVDA,2026-04-08,Here’s What UBS Has to Say About ​Corning Incorporated (GLW),"​Corning Incorporated (NYSE:GLW) is one of the Unstoppable Technology Stocks to Buy Now. On March 19, UBS reiterated a Buy rating on Corning Incorporated (NYSE:GLW) with a price target of $171. ​UBS maintained its bullish sentiment on the stock after attending the Optical Fiber Communications conference, where the firm met with fiber producers, sellers, and […]",Yahoo,https://finnhub.io/api/news?id=eef843eafbb269d11320ddd1a9f5537fd34ae8836b6c742477c1436d37f4c9d8,company,https://s.yimg.com/rz/stage/p/yahoo_finance_en-US_h_p_finance_2.png
NVDA,2026-04-08,Why BigBear.ai Stock Sank 11.1% Last Month and Has Kept Falling in April,BigBear.ai stock is now down more than 35% year to date.,Yahoo,https://finnhub.io/api/news?id=267f5028d49801b9c0b7e8a5fa5e2c9a30190a3efb011b36f7e472cbbbb23bea,company,https://s.yimg.com/rz/stage/p/yahoo_finance_en-US_h_p_finance_2.png
NVDA,2026-04-08,Why Palantir Technologies Stock Tanked on Wednesday,"Famed ""Big Short"" investor Michael Burry fired his latest salvo at Palantir.",Yahoo,https://finnhub.io/api/news?id=f5cc16c6009a57757b1e02668367c69c4d707863060ba76aa9293821afc784d3,company,https://s.yimg.com/rz/stage/p/yahoo_finance_en-US_h_p_finance_2.png
NVDA,2026-04-08,"Dow spikes by over 1,300, oil prices retreat in ceasefire rally","All three of the major indexes (^DJI, ^IXIC, ^GSPC) closed Wednesday's session with colossal gains — the Dow Jones Industrial Average skyrocketed by over 1,320 points (2.85%) and the Nasdaq Composite surged by nearly 620 points (2.8%) — after President Trump announced that Iran agreed to a two-week ceasefire last night. Yahoo Finance Markets and Data Editor Jared Blikre takes a closer look at the trading day's biggest sector gainers.",Yahoo,https://finnhub.io/api/news?id=b8eea1100721bb24dd793d8dc323694304256f54def429b5dfd4bccfcf106f54,company,https://s.yimg.com/rz/stage/p/yahoo_finance_en-US_h_p_finance_2.png
NVDA,2026-04-08,3 Top Agentic AI Stocks Investors Should Be Loading Up on Now,Agentic AI is the next big thing in the AI software race.,Yahoo,https://finnhub.io/api/news?id=b7c9bf5453b1b05a083389d909ae4e874ad3911d8f0f9569f59b35ff6d7c64de,company,https://s.yimg.com/rz/stage/p/yahoo_finance_en-US_h_p_finance_2.png
NVDA,2026-04-08,Sector Update: Tech Stocks Climb Late Afternoon,"Tech stocks were higher late Wednesday afternoon, with the State Street Technology Select Sector SPD",Yahoo,https://finnhub.io/api/news?id=6d4151cc9671d5542f578dc10fee55717d60ee68d801a71825308e70203075ed,company,https://s.yimg.com/rz/stage/p/yahoo_finance_en-US_h_p_finance_2.png
NVDA,2026-04-08,"The AI ""Capex Trap"" Is Wall Street's Biggest Fear Right Now. Here's Why I Think It's Overblown.",Investors should examine the potential benefits of this spending before panicking over its scope.,Yahoo,https://finnhub.io/api/news?id=dd06c6498e4d2646e56fca25429dd3b63d1ad773c76b3f3119c6ca6e1397f419,company,https://s.yimg.com/rz/stage/p/yahoo_finance_en-US_h_p_finance_2.png
NVDA,2026-04-08,Where Will GE Vernova (GEV) Stock Be in 10 Years?,The diversified energy giant still has a bright future.,Yahoo,https://finnhub.io/api/news?id=b849b5f42a3dfbaa1576032593e4a72ec97b2a2df2e1a4ad2b9f5043ba56bcbd,company,https://s.yimg.com/rz/stage/p/yahoo_finance_en-US_h_p_finance_2.png
NVDA,2026-04-08,Here's What Could Happen to These 2 Oil Stocks if the Iran War Ceasefire Holds,Oil prices are falling in the wake of the agreement.,Yahoo,https://finnhub.io/api/news?id=e337191733fdd7694d4a92efff3537a631545dace7faca61a6ba62814aa073a2,company,https://s.yimg.com/rz/stage/p/yahoo_finance_en-US_h_p_finance_2.png
NVDA,2026-04-08,Why Kura Sushi USA Stock Is Plummeting Today,Kura Sushi USA is falling fast despite posting better-than-expected quarterly results.,Yahoo,https://finnhub.io/api/news?id=a773c3f5e6893b1bc6ee54182b08289bf7a92d866c0eb3476e22fa983cd85308,company,https://s.yimg.com/rz/stage/p/yahoo_finance_en-US_h_p_finance_2.png
NVDA,2026-04-08,This Hot Restaurant Chain Is Going in Circles,An eatery that has more than quadrupled since going public is falling today. It could be opportunity knocking.,Yahoo,https://finnhub.io/api/news?id=a07c3bb0f971632be70ca540570dbf8ef151c8952ef4e26d40b88d1e37fcea54,company,https://s.yimg.com/rz/stage/p/yahoo_finance_en-US_h_p_finance_2.png
NVDA,2026-04-08,Why Axon Stock Bounced Back After Falling 10% Yesterday,Wall Street gave Axon an endorsement in the middle of Axon Week.,Yahoo,https://finnhub.io/api/news?id=f18ac205a770056b4194a8e557395475256045c8a8f81188549e30386e28a5f9,company,https://s.yimg.com/rz/stage/p/yahoo_finance_en-US_h_p_finance_2.png
NVDA,2026-04-08,Here's Why QXO Stock Outpaced the Market Today,Interest rates are dropping. That's good news for QXO.,Yahoo,https://finnhub.io/api/news?id=9e7a64b2b7f0d1e67e746e6a5cd8d17623aa08c200fa35868b9dd0ccb16b8ac8,company,https://s.yimg.com/rz/stage/p/yahoo_finance_en-US_h_p_finance_2.png
NVDA,2026-04-08,Forget SpaceX: Is RocketLab Stock the Better Buy?,Elon Musk's SpaceX could be worth over $2 trillion.,Yahoo,https://finnhub.io/api/news?id=8b3bcb827304fe4824e0d29c2ba4f0e8a8e001364ce024f0f7426fe1b94fbaa0,company,https://s.yimg.com/rz/stage/p/yahoo_finance_en-US_h_p_finance_2.png
NVDA,2026-04-08,"Market indexes soared on the Iran truce, but risks remain",Wall Street loved the Iran truce on Wednesday. Is the optimism justified?,Yahoo,https://finnhub.io/api/news?id=56b50bfdc32649f57495ab89ffa7b574ef7ab9f82a84bc95b363c11c13b44a30,company,https://s.yimg.com/rz/stage/p/yahoo_finance_en-US_h_p_finance_2.png
NVDA,2026-04-08,Alibaba Builds AI Data Center With Own Chips,New facility highlights China's push for semiconductor independence.,Yahoo,https://finnhub.io/api/news?id=475d2043ae5a9bac838c361f157505273f2a5de7fd4907fdc092fea1aa6d3f7f,company,https://s.yimg.com/rz/stage/p/yahoo_finance_en-US_h_p_finance_2.png
NVDA,2026-04-08,"Anthropic's Claude Mythos Preview Just Sent Shockwaves Through the Cybersecurity Industry. It's Now Joining Forces with Nvidia, Amazon, Apple, Google, and Microsoft",Anthropics latest frontier model identified vulnerabilities in every major operating system and web browser.,Yahoo,https://finnhub.io/api/news?id=4ad5be74f027d98aceb7cf3e693220853469a9a25c962b5b5eba1e5e546a25d7,company,https://s.yimg.com/rz/stage/p/yahoo_finance_en-US_h_p_finance_2.png
NVDA,2026-04-08,Why Terns Pharmaceuticals Stock Rocked the Market in March,A large peer is snapping up the company in a premium-priced deal.,Yahoo,https://finnhub.io/api/news?id=753aa0bda76bce380df17c56293cf271e043bfa443db2cbba5842c5f5eef1989,company,https://s.yimg.com/rz/stage/p/yahoo_finance_en-US_h_p_finance_2.png
NVDA,2026-04-08,2 Tech Stocks That Could Help Set You Up for Life,Wall Street's AI panic created a golden opportunity to invest in these high-quality companies at attractive valuations.,Yahoo,https://finnhub.io/api/news?id=fe3a78d15528f743b80d55c1de6fc6922d08983f4bf83af39b0308fd8a50cf79,company,https://s.yimg.com/rz/stage/p/yahoo_finance_en-US_h_p_finance_2.png
NVDA,2026-04-08,Why Tilray Stock Got Hammered in March,What's another month of struggle for a company in the cannabis industry?,Yahoo,https://finnhub.io/api/news?id=eabc52f97579163cc268cda92036c7bb865b012169006ed72942f7cf5ae7efb6,company,https://s.yimg.com/rz/stage/p/yahoo_finance_en-US_h_p_finance_2.png
NVDA,2026-04-08,Why ASML Stock Popped Today,The ceasefire in Iran was good news for ASML.,Yahoo,https://finnhub.io/api/news?id=6ea00ca607615c3cd9ba7cb80dced5669938ab711cdb87bf39d36ff7f141ccb0,company,https://s.yimg.com/rz/stage/p/yahoo_finance_en-US_h_p_finance_2.png
NVDA,2026-04-08,Better Altcoin Buy: XRP vs. TAO,"Bittensor may be outperforming XRP this year, but is it really the better long-term investment?",Yahoo,https://finnhub.io/api/news?id=a58657008c414c8e1f1f2aa15df13ce7552c1af58c06ddb5e48bafdf14c39e2b,company,https://s.yimg.com/rz/stage/p/yahoo_finance_en-US_h_p_finance_2.png
NVDA,2026-04-08,Which S&P500 stocks are the most active on Wednesday?,Stay informed about the most active stocks in the S&P500 index on Wednesday's session. Discover the stocks that are generating the highest trading volume and driving market activity.,ChartMill,https://finnhub.io/api/news?id=a49bebf16ebb5cf4d03416bb4784e16baba43f6a6c95d1ea1141941ebd89a4a2,company,https://www.chartmill.com/images/uploads/CM_Most_Active_Stocks_Small_free_fec0650b7f.webp
NVDA,2026-04-08,"Investing $10,000 In Each of These 3 Growth Stocks 5 Years Ago Would Have Created a Portfolio Worth More Than $260,000 Today",Artificial intelligence (AI) has unlocked massive growth opportunities for these businesses.,Yahoo,https://finnhub.io/api/news?id=fd717b217d6c45564befc78ace3023675a2fce6f508e83f937d70c0a2948ac3a,company,https://s.yimg.com/rz/stage/p/yahoo_finance_en-US_h_p_finance_2.png
NVDA,2026-04-08,Firmus Raises $505 Million At $5.5 Billion Valuation With Nvidia Backing,"Coatue-led funding supports Asia-Pacific AI data center expansion using Nvidia technology, with Southgate project set to deploy 36,000 accelerator chips.",Yahoo,https://finnhub.io/api/news?id=e9a09df6da98d161627459e9a96daae830128a6d6a8694c249d6536bc82f99c3,company,https://s.yimg.com/rz/stage/p/yahoo_finance_en-US_h_p_finance_2.png
NVDA,2026-04-08,Curious about the most active stocks on Wednesday?,Stay updated with the latest market activity on Wednesday. Explore the most active stocks in today's session and stay informed about the stocks that are in the spotlight.,ChartMill,https://finnhub.io/api/news?id=5acb91c20fbdbc3ed33c19b9abff1003c0f0204ba2c7ee3dedcba8000c986a22,company,https://www.chartmill.com/images/uploads/CM_Most_Active_Stocks_Small_free_fec0650b7f.webp
NVDA,2026-04-08,Market Crash: Is This the Best Time to Load Up on Cryptocurrency?,"With the crypto market in steep decline, Bitcoin looks like the best investment option for now.",Yahoo,https://finnhub.io/api/news?id=7861a8698c8e8163d61166e2cbed16e3206994c6d41f12075a16bc56639c39fc,company,https://s.yimg.com/rz/stage/p/yahoo_finance_en-US_h_p_finance_2.png
NVDA,2026-04-08,Enbridge Is Still Under $61. Here's Whether Long-Term Investors Should Pounce.,The midstream giant looks like a compelling investment in this choppy market.,Yahoo,https://finnhub.io/api/news?id=aa8228fbebd9fa9f9f7db5785de914f46994cb5cdf16c7a7ac9a832013ec5eba,company,https://s.yimg.com/rz/stage/p/yahoo_finance_en-US_h_p_finance_2.png
NVDA,2026-04-08,"With Beyond Meat Down 27% in 2026, Should You Buy, Wait, or Walk Away?",Beyond Meat went from red-hot IPO to a penny stock. Can it turn things around?,Yahoo,https://finnhub.io/api/news?id=af28d959cd1121a8f4783709f1ac1c4c032c9c555ad2c696645bb0136cf084bc,company,https://s.yimg.com/rz/stage/p/yahoo_finance_en-US_h_p_finance_2.png
NVDA,2026-04-08,The Market Forgot Nvidia: Big Mistake,Nvidia Corporation looks undervalued at a 21.46 forward P/E as AI demand accelerates. Click for this updated look at NVDA stock and see I view it as a Strong Buy.,SeekingAlpha,https://finnhub.io/api/news?id=d12b0cdea5de53e3d78f8dd0845788c4d34a9b532530993bcc1ab48851a3ebbd,company,https://static.seekingalpha.com/cdn/s3/uploads/getty_images/2148676029/image_2148676029.jpg?io=getty-c-w1536
NVDA,2026-04-08,Why D-Wave Quantum Stock Plummeted 23.2% Last Month and Has Inched Lower in April,"After some big swings, D-Wave stock is now down roughly 45% in 2026.",Yahoo,https://finnhub.io/api/news?id=f6e8c1724d7fcfcf990ef2c3fe81666ede1fadf0a61661846098fa469b732a64,company,https://s.yimg.com/rz/stage/p/yahoo_finance_en-US_h_p_finance_2.png
NVDA,2026-04-08,"The Best Trillion-Dollar Stock to Buy Right Now, According to Wall Street",The biggest stocks could keep getting bigger.,Yahoo,https://finnhub.io/api/news?id=bfeb87609d8f445e4a7ef4e8d99d81abc4bc70dd86cf0740479a66d497419276,company,https://s.yimg.com/rz/stage/p/yahoo_finance_en-US_h_p_finance_2.png
NVDA,2026-04-08,Why Direxion Daily Semiconductor Bull 3X ETF Jumped 18% Today,"Why did this leveraged semiconductor ETF jump 18% in a single morning? The answer involves Iran, helium, and a word of caution.",Yahoo,https://finnhub.io/api/news?id=ebd403bcb01e6ac6b551b9e734dabb7c3caf25e1fb687c91efa06187a1b4a959,company,https://s.yimg.com/rz/stage/p/yahoo_finance_en-US_h_p_finance_2.png
NVDA,2026-04-08,Stock Market Rebound: 3 Top AI Bargains to Snap Up Now,These AI stocks offer fantastic growth prospects today and over the long term.,Yahoo,https://finnhub.io/api/news?id=e41ac6e773bbf3c5fd6647f6cc96a885845e1bd11e644c746ac23b58b65c835a,company,https://s.yimg.com/rz/stage/p/yahoo_finance_en-US_h_p_finance_2.png
NVDA,2026-04-08,Why Micron Technology Stock Is Climbing Higher Today,A firm's new price target has investors racing to click the buy button.,Yahoo,https://finnhub.io/api/news?id=ae607f3eda87f7ba110ba84c9970143dcb21965a6a3540d53604e7e55ca1c9b7,company,https://s.yimg.com/rz/stage/p/yahoo_finance_en-US_h_p_finance_2.png
NVDA,2026-04-08,2 Monster Stocks to Hold for the Next 10 Years,Bloom Energy and Vistra could be big winners as they try to meet AI's relentless power needs.,Yahoo,https://finnhub.io/api/news?id=2c363473d9a1f93ebe98517df3578f928232ae3103943cb6b565888c0abd3156,company,https://s.yimg.com/rz/stage/p/yahoo_finance_en-US_h_p_finance_2.png
NVDA,2026-04-08,"BofA hikes 2026 chips forecast to $1.3 trillion, names Nvidia, Broadcom, Marvell, AMD as top drivers","Bank of America added $300 billion to its revenue target in just four months, doubling down on Nvidia, Broadcom, and AMD as the AI boom accelerates.",Yahoo,https://finnhub.io/api/news?id=ad4c611b29b6daa90697c0b65f3d4d8ce7015be9d2a1723c2db24fcddf934232,company,https://s.yimg.com/rz/stage/p/yahoo_finance_en-US_h_p_finance_2.png
NVDA,2026-04-08,Bridge Data Centres Replaces Tenant As Nvidia Chip Probe Intensifies,Replaces Megaspeed with Zenlayer at Malaysian hub amid US probe into potential Nvidia chip smuggling and export control concerns.,Yahoo,https://finnhub.io/api/news?id=fce2d37e7386a4a6bd5ea1751ed51c93faf3310147fd276bb5c017069abb7e37,company,https://s.yimg.com/rz/stage/p/yahoo_finance_en-US_h_p_finance_2.png
NVDA,2026-04-08,"Blast from the Past, Vol. 12: ABB","David shares five timelessly powerful ideas—about identity, investing, serenity, frameworks, and questioning—and brings them together in a fresh 2026 mix.",Yahoo,https://finnhub.io/api/news?id=cbb8696fa99a7f4db178f9fbb53e471b13508c926c8eff8a812c50ef2075659b,company,https://s.yimg.com/rz/stage/p/yahoo_finance_en-US_h_p_finance_2.png
NVDA,2026-04-08,Why Alphabet Stock Was Moving Higher Today,The Iran ceasefire was good news for the search giant.,Yahoo,https://finnhub.io/api/news?id=729a10c79265a38e9a97b7897648c43e779033170712e651c51b34315c6165dd,company,https://s.yimg.com/rz/stage/p/yahoo_finance_en-US_h_p_finance_2.png
NVDA,2026-04-08,Why e.l.f. Beauty Stock Plummeted 34.2% Last Month But Is Gaining in April,Geopolitical pressures resulted in a huge pullback for e.l.f. Beauty's valuation.,Yahoo,https://finnhub.io/api/news?id=feaf57cad0224532d855ac4e0e2823f9cbf151b98356a928ec3dc6a97cd5d25a,company,https://s.yimg.com/rz/stage/p/yahoo_finance_en-US_h_p_finance_2.png
NVDA,2026-04-08,Why Applied Digital Stock Jumped Today,Geopolitical news and high hopes for Q3 results are pushing the stock higher.,Yahoo,https://finnhub.io/api/news?id=d3723c277a6ba7d5532a9625d74a66f2360dd17388da0a9b557d58e387d1540e,company,https://s.yimg.com/rz/stage/p/yahoo_finance_en-US_h_p_finance_2.png
NVDA,2026-04-08,Here's Why Shares in Chevron Slumped Today,"The market is pricing in a favorable outcome from the conflict in the Persian Gulf, but that may prove premature.",Yahoo,https://finnhub.io/api/news?id=f34443abcb0252225fa0285c9b25c10a4dafb972544b908cd2d32439d79dc879,company,https://s.yimg.com/rz/stage/p/yahoo_finance_en-US_h_p_finance_2.png
NVDA,2026-04-08,Apple unveils shocking Nvidia move,"Apple (AAPL) just made a shocking move. It approved a third-party driver for Apple Silicon Macs, Tom's Hardware reported. Although some may view the change as minor, it could potentially create a significant opportunity for Nvidia (NVDA) in the AI space. Apple’s (AAPL) closed ecosystem is a ...",Yahoo,https://finnhub.io/api/news?id=97b0ff1000b4a89080738b3a7780a4a1c19bdf0ff369d29e06eb0ebfa85b0883,company,https://s.yimg.com/rz/stage/p/yahoo_finance_en-US_h_p_finance_2.png
NVDA,2026-04-08,2 Artificial Intelligence (AI) Stocks That Won in 2025 Are Losing in 2026. Why This Is a Buying Opportunity,"Palantir and Broadcom's stocks may be down this year, but their growth stories remain intact.",Yahoo,https://finnhub.io/api/news?id=36baec9a6417322d2fe586f7dfacf0db47ce09416cf4f9e094544a246438445f,company,https://s.yimg.com/rz/stage/p/yahoo_finance_en-US_h_p_finance_2.png
NVDA,2026-04-08,Looks Like M&A Week in 3 Different Sectors,"Some large merger & acquisition deals that could shake up the consumer goods and the food distribution industry, plus deals in the healthcare industry.",Yahoo,https://finnhub.io/api/news?id=4bf85e05a7e15a71752112ba1e22f0c4642543926acd7d9f90f9afba12c4ca35,company,https://s.yimg.com/rz/stage/p/yahoo_finance_en-US_h_p_finance_2.png
NVDA,2026-04-08,Why Nvidia Stock Is Rising Today,Nvidia Jumps as U.S.-Iran Ceasefire Eases Market Fears,Yahoo,https://finnhub.io/api/news?id=5fc889acd9297174816c0fdbcc1e68ac03eaa19d55f663dc1fcc093e996d633b,company,https://s.yimg.com/rz/stage/p/yahoo_finance_en-US_h_p_finance_2.png
NVDA,2026-04-08,Prediction: This Unloved AI Stock Has What it Takes to Outrun NVIDIA,"It’s hard to tell what can get those stalled shares of Nvidia (NASDAQ:NVDA) going again. There’s still a lot of growth and innovation going on underneath the hood. Combined with the Vera Rubin catalyst and the rise of agentic AI, as well as more monetizable vertical AI, it feels like Nvidia stock doesn’t deserve to ... Prediction: This Unloved AI Stock Has What it Takes to Outrun NVIDIA",Yahoo,https://finnhub.io/api/news?id=6a1f056e74476952b8b39741e964af4ea8d3588c512c669592c0c5a35155b590,company,https://s.yimg.com/rz/stage/p/yahoo_finance_en-US_h_p_finance_2.png
NVDA,2026-04-08,"Top Midday Stories: Stocks Rise on US-Iran Ceasefire Agreement; Delta Beats Q1 Earnings Estimates, Shares Rise",All three major US stock indexes were up over 2.0% in late-morning trading Wednesday after the US an,Yahoo,https://finnhub.io/api/news?id=938f87c416e30f7c4456e9ed02ffe0c2a6624cbbf2cf0d4a34f4bd25a29de22d,company,https://s.yimg.com/rz/stage/p/yahoo_finance_en-US_h_p_finance_2.png
NVDA,2026-04-08,Should You Buy Netflix Stock Before April 16?,Netflix stock is gradually recovering after suffering a 42% share price decline from its record high.,Yahoo,https://finnhub.io/api/news?id=be1a7a60f1089ebf6e147e473e300d7431ddf9ad6fa40d8c89b84fe1fb3f7b09,company,https://s.yimg.com/rz/stage/p/yahoo_finance_en-US_h_p_finance_2.png
NVDA,2026-04-08,The April 1 RMD Deadline Is Here -- What First-Year Retirees Need to Know,Should you double up on RMDs in your first year?,Yahoo,https://finnhub.io/api/news?id=39c415915c0853ea4c063ed7911c3c788e25b71bbd6c0a33faaa85983cbede84,company,https://s.yimg.com/rz/stage/p/yahoo_finance_en-US_h_p_finance_2.png
NVDA,2026-04-08,The 2 Best Retail Stocks to Buy and Hold No Matter What Tariffs Do,Tariffs and global disruptions are shaking the retail industry. These two companies are turning the resulting chaos into opportunity.,Yahoo,https://finnhub.io/api/news?id=9e88fca2233f7a3c607818f8bee4adb56e12353ecb113ff05dc9d5180d5b74b5,company,https://s.yimg.com/rz/stage/p/yahoo_finance_en-US_h_p_finance_2.png
NVDA,2026-04-08,A quiet switch in Nvidia's orbit is raising bigger questions,Behind-the-scenes moves show how geopolitics is starting to shape AI infrastructure decisions,Yahoo,https://finnhub.io/api/news?id=a71c5c4fd241ec094f948920277e61784c872ead55f1c1c61298935cfcc9d8c9,company,https://s.yimg.com/rz/stage/p/yahoo_finance_en-US_h_p_finance_2.png
NVDA,2026-04-08,"Got $1,000? This Under-the-Radar Growth Stock Powers Every AI Data Center On the Planet","Bloom Energy finds itself at the center of an energy crunch, and it has led to tremendous retu rns.",Yahoo,https://finnhub.io/api/news?id=95f151d2f9424ad206ae0660e6e7fd09d60b8b5c78d8e99aabd927a1543ca9f1,company,https://s.yimg.com/rz/stage/p/yahoo_finance_en-US_h_p_finance_2.png
NVDA,2026-04-08,Is Aehr Test Systems The AI Stock You Didn’t Realize You Needed to Buy?,"AI infrastructure spending hit record levels last year, yet most retail investors still chase the obvious names like Nvidia (NASDAQ:NVDA) or Broadcom (NASDAQ:AVGO). The real opportunity often sits one layer deeper — in the specialized equipment that makes those chips reliable at scale. Aehr Test Systems (NASDAQ:AEHR) supplies wafer-level and package-level burn-in systems that test ... Is Aehr Test Systems The AI Stock You Didn’t Realize You Needed to Buy?",Yahoo,https://finnhub.io/api/news?id=7e888b85dcd328183ff3546283c30869395b37b3f7a3d63de1fb947efc4a226a,company,https://s.yimg.com/rz/stage/p/yahoo_finance_en-US_h_p_finance_2.png
NVDA,2026-04-08,Rivian vs. Lucid: Which EV Stock Will Dominate the Next Decade?,Which of these beaten-down EV stocks is the better buy?,Yahoo,https://finnhub.io/api/news?id=9a2d9839f98d5e5f72cba7609af5f843bc0122f29593f1aa1c3df0df44aca27c,company,https://s.yimg.com/rz/stage/p/yahoo_finance_en-US_h_p_finance_2.png
NVDA,2026-04-08,Better Dividend Stock: ConocoPhillips vs. ExxonMobil,One company has a key edge in the energy sector.,Yahoo,https://finnhub.io/api/news?id=fd612a1bb9ba8034010ebd4b1c741b9085597c155ac57e55ef08c2a12636cfda,company,https://s.yimg.com/rz/stage/p/yahoo_finance_en-US_h_p_finance_2.png
NVDA,2026-04-08,These 3 Beaten-Down Stocks Haven't Been This Cheap in Over a Decade,"Buying stocks at incredibly low valuations often comes with risk, but it may also result in massive returns.",Yahoo,https://finnhub.io/api/news?id=e4ef7cd8e34c515d272f2d7d1d23fa6c570296bd3a8d417a76929a7e5e7ac7bc,company,https://s.yimg.com/rz/stage/p/yahoo_finance_en-US_h_p_finance_2.png
NVDA,2026-04-08,The Energy Sector Is on Fire. Is Energy Transfer the Best Way to Play It?,Energy Transfer has rallied sharply to start 2026.,Yahoo,https://finnhub.io/api/news?id=a17c4835220cdb5428560bb8e63c4e7ac7a8c5b527d6978f21b05ccb18e954be,company,https://s.yimg.com/rz/stage/p/yahoo_finance_en-US_h_p_finance_2.png
NVDA,2026-04-08,Broadcom Stock Gets a Rare Downgrade. Why Its Good News Is Actually Bad.,"Seaport Research Partners says Broadcom may need to help finance AI data centers, including an Anthropic project, raising concerns about industry strain.",Yahoo,https://finnhub.io/api/news?id=982ccaececf074e6d77c86024cd67e93e1772ec6b64a7ba9df4e663f8c217e47,company,https://s.yimg.com/rz/stage/p/yahoo_finance_en-US_h_p_finance_2.png
NVDA,2026-04-08,Is Callaway Golf Stock a Buy After O'Keefe Stevens Advisory Increased Its Stake to 1.2 Million Shares?,"Callaway Golf Company blends golf equipment, lifestyle apparel, and venue-based entertainment across global markets.",Yahoo,https://finnhub.io/api/news?id=1e2f28ddce989ce860397593fa16567c121e89bc27697a38ad3cbf8e50986024,company,https://s.yimg.com/rz/stage/p/yahoo_finance_en-US_h_p_finance_2.png
NVDA,2026-04-08,1 High-Risk AI Stock That Could Become a Massive Winner -- If It Gets This Right,CoreWeave is a high-risk AI stock sitting at the backbone of the AI boom.,Yahoo,https://finnhub.io/api/news?id=21ba7bbf15cfdd3077f50133fdc8964f88fcac93fa030f02d286bf56dbf3ab37,company,https://s.yimg.com/rz/stage/p/yahoo_finance_en-US_h_p_finance_2.png
NVDA,2026-04-08,3 Dividend Stocks to Double Up On Right Now,"From energy to healthcare, this trio of reliable dividend payers are worth a deep dive today.",Yahoo,https://finnhub.io/api/news?id=2086e181ac6d59054f03f0c566d964f51a888c4873d6f5694f0b8d0077b67483,company,https://s.yimg.com/rz/stage/p/yahoo_finance_en-US_h_p_finance_2.png
NVDA,2026-04-08,Charles Schwab Warns That Asian and European Stocks May Not Resume Their Outperformance Even After the War Ends. What That Means for Your Global Portfolio.,Schwab's warning came as reduced oil supplies led to rationing and energy conservation measures in parts of the world.,Yahoo,https://finnhub.io/api/news?id=69c76a8cbcf00f4c955ce6054b8b8ccc695306c1184c41670fa8b89f97b1aee7,company,https://s.yimg.com/rz/stage/p/yahoo_finance_en-US_h_p_finance_2.png
NVDA,2026-04-08,Investor Sells Entire Tri Pointe Homes Stake Amid 55% Stock Surge and Pending Deal,"Tri Pointe Homes designs and sells single-family homes nationwide, with shares up over 50% year-over-year as of the latest filing.",Yahoo,https://finnhub.io/api/news?id=ad5ef06b361966f56721ebe8030bb46cf0648189b91de98a7b2da8a176a62808,company,https://s.yimg.com/rz/stage/p/yahoo_finance_en-US_h_p_finance_2.png
